Full Name	Short Name
photosystem II protein D2	psbD
PsbD	psbD
photosystem II reaction center protein D2	psbD
photosystem II D2 protein	psbD
PSII D2 protein	psbD
photosystem II subunit D2	psbD
photosystem II CP43 chlorophyll	psbD
photosystem II P680 reaction center D2 protein	psbD
photosystem II D2protein	psbD
photosystem II protein D2'	psbD
psbD protein	psbD
PSII protein D2	psbD
PsbD; photosystem II protein D2	psbD
PSII D2-protein	psbD
D2 reaction center protein of photosystem II	psbD
photosystem II D2-reaction-center protein	psbD
photosytem II protein D2	psbD
photosystem II reaction center D2 protein	psbD
